Email,Course Code,Course Title,Units,Section,Times,Days,Rooms,
jmdoe@test.edu,CMSC 12,Foundations of Computer Science,3,G,4:00-5:00,WF,EAA LH (D-206),
jmdoe@test.edu,CMSC 21,Fundamentals of Programming,3,UV,11:00-12:00,TTh,EAA LH (D-206),
cpyester@test.edu,CMSC 22,Object Oriented Programming,3,UV,11:00-12:00,TTh,SMA LH (D-306),
cpyester@test.edu,CMSC 56,Discrete Mathematical Structures in Computer Science I,3,A,7:00-8:00,WF,SMA LH (D-306),
cpyester@test.edu,CMSC 12,Foundations of Computer Science,3,G-2L,10:00-1:00,Tues,PhySci C-100,
